{
  "$schema": "../../schema/sampling_plan.schema.json",
  "sampling_plan_schema_version": "v0.1.0",
  "plan_id": "anx_us_2026w07_cross_domain_bridge_sampling_plan",
  "benchmark_version": "v0.7.0",
  "wave_id": "anx_us_2026w07_cross_domain_bridge",
  "registration": {
    "sampling_plan_path": "sampling/v0.7/anx_us_2026w07_cross_domain_bridge_sampling_plan.template.json",
    "preregistration_path": "docs/preregistrations/anx_us_2026w07_cross_domain_bridge.md",
    "authoritative_contract": true,
    "freeze_status": "frozen_before_fielding",
    "outcome_inspection_status": "not_inspected"
  },
  "target_population": {
    "population_id": "us_adults_online_english_2026",
    "description": "Non-institutionalized adults age 18 or older residing in the United States who can complete an English-language online self-administered survey.",
    "geography": "United States",
    "age_range": {
      "minimum": 18,
      "maximum": null
    },
    "language": "English",
    "inclusion_criteria": [
      "Age 18 or older at screening.",
      "Current residence in the United States or District of Columbia.",
      "Able to complete the survey in English without assistance.",
      "Provides informed consent before any ANX-Bench item is administered."
    ],
    "exclusion_criteria": [
      "Under age 18.",
      "Residence outside the United States or District of Columbia.",
      "Unable to self-administer the English survey.",
      "Duplicate, vendor-confirmed fraud, withdrawal of consent, breakoff without usable ANX item data, or preregistered quality-control exclusion."
    ],
    "coverage_limits": [
      "The frame does not cover adults who cannot access or complete online surveys in English.",
      "Institutionalized adults, adults without stable panel reachability, and adults excluded by vendor fraud controls are outside the covered analytic frame.",
      "Weighted estimates are calibrated descriptive estimates for the covered online adult population, not a full probability-sample estimate of all US adults."
    ]
  },
  "sampling_frame": {
    "frame_id": "professional_online_panel_us_adults",
    "frame_type": "nonprobability_online_panel",
    "frame_description": "A high-quality professional online panel with profile variables for demographic quota monitoring, duplicate detection, AI-exposure screening, and post-fielding calibration to external margins.",
    "known_undercoverage": [
      "Adults not reachable through online panels.",
      "Adults with limited English proficiency.",
      "Adults with low digital access or low survey-panel participation propensity."
    ],
    "deduplication_rule": "Vendor and study-level duplicate checks must remove repeated panel identifiers, device or fingerprint duplicates when available, and records flagged as confirmed fraud before weights are finalized."
  },
  "recruitment_source": {
    "source_type": "nonprobability",
    "vendor_or_panel": "Professional online panel vendor selected before fielding",
    "recruitment_mode": "Panel invitation with quota monitoring and respondent-level eligibility screening before ANX-Bench item exposure.",
    "eligibility_screening": "Screening confirms age, US residence, English self-administration ability, consent, and no known prior participation in Wave 5 or Wave 6 when protected panel linkage is available.",
    "nonresponse_tracking": "Vendor disposition counts must archive invitations, starts, screenouts, quota stops, breakoffs, completes, exclusions, and final analytic eligible cases."
  },
  "quota_variables": [
    {
      "variable_id": "age_group",
      "source_field": "age_group",
      "quota_role": "soft_quota",
      "categories": [
        "18_29",
        "30_44",
        "45_59",
        "60_plus"
      ],
      "margin_source": "Current Population Survey or ACS adult margins available before weighting",
      "minimum_cell_n": 125
    },
    {
      "variable_id": "gender",
      "source_field": "gender",
      "quota_role": "soft_quota",
      "categories": [
        "woman",
        "man",
        "nonbinary_or_another_identity"
      ],
      "margin_source": "CPS or vendor-calibrated adult panel benchmarks with nonbinary category monitored descriptively",
      "minimum_cell_n": 50
    },
    {
      "variable_id": "race_ethnicity",
      "source_field": "race_ethnicity",
      "quota_role": "soft_quota",
      "categories": [
        "hispanic_any_race",
        "white_non_hispanic",
        "black_non_hispanic",
        "asian_non_hispanic",
        "other_or_multiple_non_hispanic"
      ],
      "margin_source": "ACS adult race and ethnicity margins",
      "minimum_cell_n": 100
    },
    {
      "variable_id": "education",
      "source_field": "education",
      "quota_role": "soft_quota",
      "categories": [
        "high_school_or_less",
        "some_college_or_associate",
        "bachelors_or_higher"
      ],
      "margin_source": "ACS or CPS adult education margins",
      "minimum_cell_n": 180
    },
    {
      "variable_id": "census_region",
      "source_field": "census_region",
      "quota_role": "soft_quota",
      "categories": [
        "northeast",
        "midwest",
        "south",
        "west"
      ],
      "margin_source": "Census adult regional distribution",
      "minimum_cell_n": 150
    },
    {
      "variable_id": "employment_status",
      "source_field": "employment_status",
      "quota_role": "monitor_only",
      "categories": [
        "employed_full_time",
        "employed_part_time",
        "self_employed",
        "unemployed",
        "student_homemaker_retired_or_other"
      ],
      "margin_source": "CPS labor-force status margins where category mapping is stable",
      "minimum_cell_n": 75
    },
    {
      "variable_id": "occupation_group",
      "source_field": "occupation_group",
      "quota_role": "monitor_only",
      "categories": [
        "management_business_science_arts",
        "service",
        "sales_office",
        "natural_resources_construction_maintenance",
        "production_transportation_material_moving",
        "not_currently_employed"
      ],
      "margin_source": "CPS occupation group margins for employed adults, with nonemployed monitored separately",
      "minimum_cell_n": 60
    },
    {
      "variable_id": "prior_ai_exposure_frequency",
      "source_field": "prior_ai_exposure_frequency",
      "quota_role": "monitor_only",
      "categories": [
        "never_or_rarely",
        "monthly",
        "weekly",
        "daily"
      ],
      "margin_source": "No authoritative population margin; use same-wave distribution for sensitivity only",
      "minimum_cell_n": 100
    },
    {
      "variable_id": "ai_news_exposure_30d",
      "source_field": "ai_news_exposure_30d",
      "quota_role": "monitor_only",
      "categories": [
        "none_or_low",
        "moderate",
        "high"
      ],
      "margin_source": "No authoritative population margin; use same-wave distribution for sensitivity only",
      "minimum_cell_n": 150
    }
  ],
  "planned_n_by_split": [
    {
      "split_id": "bridge_sample",
      "target_n": 1500,
      "minimum_usable_n": 1200,
      "role": "Independent cross-domain bridge sample after preregistered exclusions.",
      "claim_role": "bridge"
    }
  ],
  "weighting_method": {
    "status": "planned",
    "method": "raking",
    "construction_steps": [
      "Start from one base weight per eligible respondent because the planned panel source does not provide unequal selection probabilities for a probability sample.",
      "Remove ineligible and preregistered excluded respondents before fitting final analytic weights.",
      "Rake eligible respondents to external adult margins for age group, gender, race and ethnicity, education, and Census region.",
      "Evaluate employment status and occupation group as calibration variables when external margins map cleanly to collected categories; otherwise report them as monitored sensitivity variables.",
      "Do not rake on AI exposure or AI-news exposure unless a prespecified external benchmark is available before outcome inspection.",
      "Trim weights to the frozen lower and upper bounds, rescale to mean one, and archive weighted and unweighted diagnostics before outcome analysis."
    ],
    "raking_variables": [
      "age_group",
      "gender",
      "race_ethnicity",
      "education",
      "census_region",
      "employment_status",
      "occupation_group"
    ],
    "base_weight_variable": "base_weight",
    "final_weight_variable": "final_weight",
    "survey_weight_mapping": {
      "wave_response_field": "survey_weight",
      "source_variable": "final_weight",
      "mapping_rule": "Copy respondent-level final_weight to survey_weight on every respondent-item row after trimming and mean-one rescaling."
    },
    "diagnostics": [
      "Effective sample size overall and by planned split.",
      "Weight minimum, maximum, mean, median, coefficient of variation, design effect, and percent trimmed.",
      "Weighted and unweighted distributions for each quota variable.",
      "Maximum absolute marginal deviation from each external raking target.",
      "Sensitivity table comparing primary descriptive estimates with unweighted estimates."
    ]
  },
  "trim_bounds": {
    "lower": 0.3,
    "upper": 3.0,
    "scale": "mean_one",
    "exception_rule": "Weights outside 0.30 to 3.00 are trimmed before rescaling; wider bounds require a frozen addendum before outcome inspection and cannot be chosen based on ANX outcomes."
  },
  "variance_design": {
    "estimator": "linearization",
    "primary_standard_error": "Taylor linearization using final survey_weight for weighted descriptive estimates; psychometric model decisions remain governed by the analysis plan.",
    "strata_variable": null,
    "cluster_variable": null,
    "replicate_weight_variables": [],
    "finite_population_correction": null,